{
  "status": "partial",
  "summary": "7 of 7 benchmarks run (2026-10-23, code bdedeb7). Acceptance met: synthetic-corn-stands, corn-photos-label-free, weedsgalore-position, weedsgalore-stage. Not met: weedsgalore-vegetation, weedsgalore-cover, map-corn-rows. Written by npm run profiles:record from the result files; the profile stays experimental.",
  "benchmarks": [
    {
      "id": "synthetic-corn-stands",
      "name": "Rendered corn stands: rows, pitch, phase, off-row weeds",
      "capability": "row-detection",
      "dataset": "Rendered scenes (scripts/cropProfiles/scenes.ts): 20, 22, 30, 36 in and twin rows; 0.3 to 4 cm; soil, red soil with straw stripes, weeds; development seeds 1 to 20, evaluation seeds 101 to 160",
      "images": 0,
      "gsdCm": "0.3 to 4",
      "stages": [
        "V2",
        "V3",
        "V4",
        "V5",
        "V6"
      ],
      "split": "seeded scenes; parameters were set on development seeds only, scores reported on evaluation seeds",
      "command": "npm run bench:crop-profile -- --suite synthetic",
      "acceptance": [
        {
          "metric": "rows found on evaluation scenes",
          "threshold": ">= 95%",
          "met": true
        },
        {
          "metric": "median pitch error",
          "threshold": "<= 3%",
          "met": true
        },
        {
          "metric": "row lines on the crop (phase error under a quarter pitch)",
          "threshold": ">= 95%",
          "met": true
        }
      ],
      "status": "run",
      "notes": "Synthetic: tests the engine against known geometry and known failure conditions, not field accuracy.",
      "date": "2026-10-23",
      "codeRevision": "bdedeb7",
      "resultFile": "10_validation/results/synthetic.json",
      "metrics": {
        "scenes": 60,
        "rowsFound": 0.983,
        "correctRows": 0.9,
        "wrongRows": 0.083,
        "medianPitchErr": 0.001,
        "linesOnCrop": 0.95,
        "offRowPrecision": 0.848,
        "offRowRecall": 0.507,
        "neutralCorrectRows": 0.783,
        "neutralWrongRows": 0.217,
        "neutralLinesOnCrop": 0.821,
        "neutralOffRowPrecision": 0.694,
        "neutralOffRowRecall": 0.432,
        "strawCorrectRows": 0.8,
        "strawNeutralCorrectRows": 0.56
      }
    },
    {
      "id": "corn-photos-label-free",
      "name": "Three early-corn photos: rows found and rows on green (label-free)",
      "capability": "row-detection",
      "dataset": "CropTesting/Corn/earlystage (3 photos, no EXIF, no labels)",
      "images": 3,
      "gsdCm": "0.2 to 0.5 (from the measured pitch and an assumed 30 in)",
      "stages": [
        "V3",
        "V4",
        "V5"
      ],
      "split": "development: 0359 was used to diagnose the residue failure",
      "command": "npm run bench:crop-profile -- --suite photos",
      "acceptance": [
        {
          "metric": "photos with rows found",
          "threshold": "3 of 3",
          "met": true
        },
        {
          "metric": "green on the row lines against green mid-alley",
          "threshold": ">= 2 on every photo",
          "met": true
        }
      ],
      "status": "run",
      "notes": "No ground truth: the on-green ratio is a proxy that rows sit on the vegetation.",
      "sources": [
        "swardus-corn-photos-2026-10-23",
        "meyer-neto-2008"
      ],
      "date": "2026-10-23",
      "codeRevision": "6d64eee",
      "resultFile": "10_validation/results/photos.json",
      "metrics": {
        "photosWithRows": 3,
        "neutralPhotosWithRows": 2,
        "minOnGreenRatio": 12.135,
        "onGreen 0359_jpg": 12.135,
        "onGreen ba2a945c": 134.774,
        "onGreen pic1.jpg": 91.391,
        "neutral onGreen 0359_jpg": 0.387,
        "neutral onGreen ba2a945c": 134.774,
        "neutral onGreen pic1.jpg": "none"
      }
    },
    {
      "id": "weedsgalore-vegetation",
      "name": "WeedsGalore held-out patches: vegetation segmentation",
      "capability": "vegetation-segmentation",
      "dataset": "WeedsGalore (Celikkan et al. 2025), test split",
      "licence": "CC BY 4.0",
      "images": 26,
      "gsdCm": "0.25 native; 1 and 2 by box averaging",
      "stages": [
        "V1",
        "V3",
        "V5",
        "V7"
      ],
      "split": "the authors spatial split (field patches never shared between splits); band gains set on train+val only",
      "command": "npm run bench:crop-profile -- --suite weedsgalore",
      "acceptance": [
        {
          "metric": "vegetation IoU at native resolution",
          "threshold": ">= 0.70",
          "met": false
        }
      ],
      "status": "run",
      "sources": [
        "weedsgalore-2025"
      ],
      "date": "2026-10-23",
      "codeRevision": "6d64eee",
      "resultFile": "10_validation/results/weedsgalore.json",
      "metrics": {
        "iou025": 0.41,
        "iou1": 0.458,
        "iou2": 0.394,
        "neutralIou025": 0.25,
        "neutralIou1": 0.405,
        "neutralIou2": 0.451
      }
    },
    {
      "id": "weedsgalore-position",
      "name": "WeedsGalore held-out patches: crop versus weed by position",
      "capability": "crop-vs-weed-by-position",
      "dataset": "WeedsGalore test split",
      "licence": "CC BY 4.0",
      "images": 26,
      "gsdCm": "0.25, 1, 2",
      "stages": [
        "V1",
        "V3",
        "V5",
        "V7"
      ],
      "split": "as above",
      "command": "npm run bench:crop-profile -- --suite weedsgalore",
      "acceptance": [
        {
          "metric": "weed pixels off the row band (recall of the position rule)",
          "threshold": "reported, no target: in-row weeds are out of reach by design",
          "met": true
        },
        {
          "metric": "maize pixels inside the row band",
          "threshold": ">= 0.85",
          "met": true
        }
      ],
      "status": "run",
      "sources": [
        "weedsgalore-2025"
      ],
      "date": "2026-10-23",
      "codeRevision": "6d64eee",
      "resultFile": "10_validation/results/weedsgalore.json",
      "metrics": {
        "weedOutsideBand025": 0.626,
        "weedOutsideBand1": 0.624,
        "weedOutsideBand2": 0.661,
        "maizeInsideBand025": 0.968,
        "maizeInsideBand1": 0.968,
        "maizeInsideBand2": 0.946,
        "offBandVegetationThatIsWeed1": 0.982,
        "automaticRowsFound1cm": 0.692
      }
    },
    {
      "id": "weedsgalore-cover",
      "name": "WeedsGalore held-out patches: between-row weed cover against labels",
      "capability": "between-row-weed-cover",
      "dataset": "WeedsGalore test split",
      "licence": "CC BY 4.0",
      "images": 26,
      "gsdCm": "0.25, 1, 2",
      "stages": [
        "V1",
        "V3",
        "V5",
        "V7"
      ],
      "split": "as above",
      "command": "npm run bench:crop-profile -- --suite weedsgalore",
      "acceptance": [
        {
          "metric": "mean absolute error of off-row weed cover per patch",
          "threshold": "<= 0.03",
          "met": false
        }
      ],
      "status": "run",
      "sources": [
        "weedsgalore-2025"
      ],
      "date": "2026-10-23",
      "codeRevision": "6d64eee",
      "resultFile": "10_validation/results/weedsgalore.json",
      "metrics": {
        "mae025": 0.014,
        "mae1": 0.02,
        "mae2": 0.031,
        "bias025": -0.009,
        "bias1": -0.02,
        "bias2": -0.031,
        "neutralMae025": 0.368,
        "neutralMae1": 0.148,
        "neutralMae2": 0.013
      }
    },
    {
      "id": "weedsgalore-stage",
      "name": "WeedsGalore dates: calendar stage estimate against the stated stages",
      "capability": "stage-estimate",
      "dataset": "WeedsGalore dates (sown 9 May 2023; first flight stated as V1)",
      "licence": "CC BY 4.0",
      "images": 0,
      "gsdCm": "n/a",
      "stages": [
        "V1"
      ],
      "split": "n/a",
      "command": "npm run bench:crop-profile -- --suite stage",
      "acceptance": [
        {
          "metric": "stated stage inside the estimated range",
          "threshold": "every date with a stated stage",
          "met": true
        }
      ],
      "status": "run",
      "sources": [
        "weedsgalore-2025"
      ],
      "date": "2026-10-23",
      "codeRevision": "6d64eee",
      "resultFile": "10_validation/results/stage.json",
      "metrics": {
        "statedDates": 1,
        "statedInRange": 1,
        "2023-05-25": "VE to V4",
        "2023-05-30": "VE to V6",
        "2023-06-06": "VE to V9",
        "2023-06-15": "V6 to V12"
      }
    },
    {
      "id": "map-corn-rows",
      "name": "Corn rows read from a field map, and the grade on them",
      "capability": "weed-pressure-grade",
      "dataset": "The 60 held-out rendered scenes (seeds 3000+) and the three early-corn photos, each placed as a stand-in field map (scripts/cropProfiles/standInMap.ts)",
      "images": 63,
      "gsdCm": "maps at the deepest zoom not finer than each image; rows read at about 3 cm, Stage 1 at 3 cm",
      "stages": [
        "V2",
        "V3",
        "V4",
        "V5",
        "V6"
      ],
      "split": "held-out scenes only; acceptance set before the first run",
      "command": "npm run bench:crop-profile -- --suite map",
      "acceptance": [
        {
          "metric": "rows found on the held-out scenes",
          "threshold": ">= 0.95",
          "met": true
        },
        {
          "metric": "scenes whose row lines are on the crop (three quarters within a quarter pitch)",
          "threshold": ">= 0.90",
          "met": false
        },
        {
          "metric": "grade refused until the rows are confirmed, then run, on every scene with rows",
          "threshold": "1.0",
          "met": true
        },
        {
          "metric": "field cover against the true weed cover between the rows, mean absolute error",
          "threshold": "<= 0.03",
          "met": true
        }
      ],
      "status": "run",